ДЗ - 3
Работа с MVCC
Описание/Пошаговая инструкция выполнения домашнего задания:
Выполнить pgbench -c8 -P 6 -T 60 -U postgres postgres.
Настроить параметры vacuum/autovacuum.
Заново протестировать: pgbench -c8 -P 6 -T 60 -U postgres postgres и сравнить результаты.
Создать таблицу с текстовым полем и заполнить случайными или сгенерированными данным в размере 1млн строк.
Посмотреть размер файла с таблицей.
5 раз обновить все строчки и добавить к каждой строчке любой символ.
Посмотреть количество мертвых строчек в таблице и когда последний раз приходил автовакуум.
Отключить Автовакуум на таблице и опять 5 раз обновить все строки.
Объяснить полученные результаты.


Привел комманды используемые в ходе работы над домашним заданием
psql (16.9 (Ubuntu 16.9-0ubuntu0.24.04.1))

В ходе настроийки параметров по autovacuum столкнулся с проблемой,
которая описана в конце файла.

-----
wsl psql -U postgres -h 127.0.0.1 -p 5432

-----
postgres=# select current_setting('config_file');
             current_setting
-----------------------------------------
 /etc/postgresql/16/main/postgresql.conf

-----
test=> \dt
              List of relations
 Schema |       Name       | Type  |  Owner
--------+------------------+-------+----------
 public | pgbench_accounts | table | postgres
 public | pgbench_branches | table | postgres
 public | pgbench_history  | table | postgres
 public | pgbench_tellers  | table | postgres
 public | student          | table | test
 public | test             | table | test
(6 rows)

-----
test=> SELECT pg_size_pretty(pg_total_relation_size('student'));
 pg_size_pretty
----------------
 135 MB
(1 row)

-----
postgres@comp1:/mnt/c/Users/comp2$ pgbench -i -d test -U postgres -h 127.0.0.1 -p 5432
Password: 
dropping old tables...
NOTICE:  table "pgbench_accounts" does not exist, skipping
NOTICE:  table "pgbench_branches" does not exist, skipping
NOTICE:  table "pgbench_history" does not exist, skipping
NOTICE:  table "pgbench_tellers" does not exist, skipping
creating tables...
generating data (client-side)...
100000 of 100000 tuples (100%) done (elapsed 0.03 s, remaining 0.00 s)
vacuuming...
creating primary keys...
done in 0.19 s (drop tables 0.00 s, create tables 0.02 s, client-side generate 0.10 s, vacuum 0.03 s, primary keys 0.05 s).

-----
ВАРИАНТ 1
postgres@comp1:/mnt/c/Users/comp2$ pgbench -c 50 -j 2 -P 10 -T 60 test
pgbench (16.9 (Ubuntu 16.9-0ubuntu0.24.04.1))
starting vacuum...end.
progress: 10.0 s, 550.3 tps, lat 89.406 ms stddev 105.072, 0 failed
progress: 20.0 s, 552.6 tps, lat 89.939 ms stddev 114.548, 0 failed
progress: 30.0 s, 555.5 tps, lat 90.582 ms stddev 113.551, 0 failed
progress: 40.0 s, 568.6 tps, lat 88.091 ms stddev 107.230, 0 failed
progress: 50.0 s, 583.7 tps, lat 85.717 ms stddev 105.763, 0 failed
progress: 60.0 s, 578.4 tps, lat 85.571 ms stddev 99.055, 0 failed
transaction type: <builtin: TPC-B (sort of)>
scaling factor: 1
query mode: simple
number of clients: 50
number of threads: 2
maximum number of tries: 1
duration: 60 s
number of transactions actually processed: 33941
number of failed transactions: 0 (0.000%)
latency average = 88.373 ms
latency stddev = 107.887 ms
initial connection time = 55.584 ms
tps = 565.158113 (without initial connection time)

-----
ВАРИАНТ 2
postgres@comp1:/mnt/c/Users/comp2$ pgbench -c8 -P 6 -T 60 test
pgbench (16.9 (Ubuntu 16.9-0ubuntu0.24.04.1))
starting vacuum...end.
progress: 6.0 s, 609.0 tps, lat 13.080 ms stddev 10.266, 0 failed
progress: 12.0 s, 618.0 tps, lat 12.928 ms stddev 10.027, 0 failed
progress: 18.0 s, 610.7 tps, lat 13.089 ms stddev 10.293, 0 failed
progress: 24.0 s, 607.8 tps, lat 13.127 ms stddev 10.736, 0 failed
progress: 30.0 s, 607.7 tps, lat 13.162 ms stddev 10.385, 0 failed
progress: 36.0 s, 639.5 tps, lat 12.501 ms stddev 9.059, 0 failed
progress: 42.0 s, 631.0 tps, lat 12.679 ms stddev 9.530, 0 failed
progress: 48.0 s, 622.7 tps, lat 12.833 ms stddev 10.283, 0 failed
progress: 54.0 s, 634.8 tps, lat 12.587 ms stddev 9.701, 0 failed
progress: 60.0 s, 640.8 tps, lat 12.475 ms stddev 9.050, 0 failed
transaction type: <builtin: TPC-B (sort of)>
scaling factor: 1
query mode: simple
number of clients: 8
number of threads: 1
maximum number of tries: 1
duration: 60 s
number of transactions actually processed: 37340
number of failed transactions: 0 (0.000%)
latency average = 12.841 ms
latency stddev = 9.940 ms
initial connection time = 14.109 ms
tps = 622.361547 (without initial connection time)

-----
add to end /etc/postgresql/16/main/postgresql.conf

# Connectivity
max_connections = 100
superuser_reserved_connections = 3

# Memory Settings
shared_buffers = 4GB
effective_cache_size = 12GB
work_mem = 16MB
maintenance_work_mem = 420MB

fsync = on
synchronous_commit = on
checkpoint_completion_target = 0.9
effective_io_concurrency = 100
random_page_cost = 1.25

min_wal_size = 512MB
max_wal_size = 1GB
wal_buffers = -1

-----
select pg_reload_conf();
sudo pg_ctlcluster 16 main restart

postgres=# show work_mem;
FATAL:  terminating connection due to administrator command
SSL connection has been closed unexpectedly
The connection to the server was lost. Attempting reset: Succeeded.
SSL connection (protocol: TLSv1.3, cipher: TLS_AES_256_GCM_SHA384, compression: off)

postgres=# show work_mem;
-[ RECORD 1 ]--
work_mem | 16MB

-----
postgres@comp1:/mnt/c/Users/comp2$ pgbench -c 50 -j 2 -P 10 -T 60 test
pgbench (16.9 (Ubuntu 16.9-0ubuntu0.24.04.1))
starting vacuum...end.
progress: 10.0 s, 587.4 tps, lat 83.717 ms stddev 105.314, 0 failed
progress: 20.0 s, 592.5 tps, lat 84.255 ms stddev 113.416, 0 failed
progress: 30.0 s, 592.3 tps, lat 84.309 ms stddev 99.010, 0 failed
progress: 40.0 s, 593.8 tps, lat 83.630 ms stddev 143.334, 0 failed
progress: 50.0 s, 592.8 tps, lat 85.400 ms stddev 176.562, 0 failed
progress: 60.0 s, 592.9 tps, lat 83.825 ms stddev 114.154, 0 failed
transaction type: <builtin: TPC-B (sort of)>
scaling factor: 1
query mode: simple
number of clients: 50
number of threads: 2
maximum number of tries: 1
duration: 60 s
number of transactions actually processed: 35567
number of failed transactions: 0 (0.000%)
latency average = 84.319 ms
latency stddev = 128.225 ms
initial connection time = 56.542 ms
tps = 592.558576 (without initial connection time)

-----
postgres@comp1:/mnt/c/Users/comp2$ pgbench -c8 -P 6 -T 60 test
pgbench (16.9 (Ubuntu 16.9-0ubuntu0.24.04.1))
starting vacuum...end.
progress: 6.0 s, 619.7 tps, lat 12.842 ms stddev 10.483, 0 failed
progress: 12.0 s, 618.5 tps, lat 12.922 ms stddev 10.218, 0 failed
progress: 18.0 s, 618.5 tps, lat 12.924 ms stddev 9.689, 0 failed
progress: 24.0 s, 616.5 tps, lat 12.963 ms stddev 9.857, 0 failed
progress: 30.0 s, 612.3 tps, lat 13.065 ms stddev 10.190, 0 failed
progress: 36.0 s, 618.0 tps, lat 12.926 ms stddev 10.150, 0 failed
progress: 42.0 s, 627.3 tps, lat 12.740 ms stddev 9.450, 0 failed
progress: 48.0 s, 619.7 tps, lat 12.907 ms stddev 10.164, 0 failed
progress: 54.0 s, 610.5 tps, lat 13.089 ms stddev 10.704, 0 failed
progress: 60.0 s, 625.7 tps, lat 12.751 ms stddev 9.817, 0 failed
transaction type: <builtin: TPC-B (sort of)>
scaling factor: 1
query mode: simple
number of clients: 8
number of threads: 1
maximum number of tries: 1
duration: 60 s
number of transactions actually processed: 37128
number of failed transactions: 0 (0.000%)
latency average = 12.915 ms
latency stddev = 10.079 ms
initial connection time = 15.992 ms
tps = 618.852592 (without initial connection time)

-----
Похоже, что tps в-первом варианте увеличился незначительно, а во-втором даже уменьшился.
Параметры, точно применились.

-----
Настроить параметры vacuum/autovacuum

SELECT name, setting, context, short_desc
FROM pg_settings WHERE name like 'vacuum%';

add to end /etc/postgresql/16/main/postgresql.conf
vacuum_cost_delay = 0
vacuum_cost_limit = 200
vacuum_cost_page_hit = 1
vacuum_cost_page_miss = 5
vacuum_cost_page_dirty = 10

SELECT name, setting, context, short_desc
FROM pg_settings WHERE name like 'autovacuum%';

add to end /etc/postgresql/16/main/postgresql.conf
log_autovacuum_min_duration = 1
autovacuum_max_workers = 5
autovacuum_naptime = 15s
autovacuum_vacuum_threshold = 25
autovacuum_vacuum_scale_factor = 0.1
autovacuum_vacuum_cost_delay = 10ms
autovacuum_vacuum_cost_limit = 1000

-----
Если в autovacuum_max_workers упустить в конце букву s,
то вариант типа autovacuum_max_worker = 5 полностью кладет доступ к постгресу.
При попытке подключиться:
sudo -u postgres psql
psql: error: connection to server on socket "/var/run/postgresql/.s.PGSQL.5432" failed: No such file or directory
        Is the server running locally and accepting connections on that socket?

При попытке рестарта:
sudo pg_ctlcluster 16 main restart
Job for postgresql@16-main.service failed because the service did not take the steps required by its unit configuration.
See "systemctl status postgresql@16-main.service" and "journalctl -xeu postgresql@16-main.service" for details.

Выход, это удаление добавленных параметров по autovacuum 
и рестарт сервиса 
sudo systemctl restart postgresql.service

-----
select pg_reload_conf();
sudo pg_ctlcluster 16 main restart

-----
Вариант 1
postgres@comp1:~$ pgbench -c 50 -j 2 -P 10 -T 60 test
pgbench (16.9 (Ubuntu 16.9-0ubuntu0.24.04.1))
starting vacuum...end.
progress: 10.0 s, 587.4 tps, lat 83.911 ms stddev 102.396, 0 failed
progress: 20.0 s, 596.9 tps, lat 83.572 ms stddev 94.707, 0 failed
progress: 30.0 s, 593.5 tps, lat 83.922 ms stddev 114.373, 0 failed
progress: 40.0 s, 588.7 tps, lat 84.892 ms stddev 123.008, 0 failed
progress: 50.0 s, 582.8 tps, lat 85.940 ms stddev 110.242, 0 failed
progress: 60.0 s, 581.8 tps, lat 86.194 ms stddev 107.876, 0 failed
transaction type: <builtin: TPC-B (sort of)>
scaling factor: 1
query mode: simple
number of clients: 50
number of threads: 2
maximum number of tries: 1
duration: 60 s
number of transactions actually processed: 35361
number of failed transactions: 0 (0.000%)
latency average = 84.806 ms
latency stddev = 109.090 ms
initial connection time = 60.361 ms
tps = 589.145576 (without initial connection time)

tps увеличение на 24
по остальным параметрам тоже небольшое улучшение

-----
Вариант 2
postgres@comp1:~$ pgbench -c8 -P 6 -T 60 test
pgbench (16.9 (Ubuntu 16.9-0ubuntu0.24.04.1))
starting vacuum...end.
progress: 6.0 s, 601.3 tps, lat 13.226 ms stddev 9.770, 0 failed
progress: 12.0 s, 625.5 tps, lat 12.787 ms stddev 9.535, 0 failed
progress: 18.0 s, 638.2 tps, lat 12.521 ms stddev 9.284, 0 failed
progress: 24.0 s, 625.7 tps, lat 12.779 ms stddev 9.497, 0 failed
progress: 30.0 s, 625.3 tps, lat 12.781 ms stddev 9.661, 0 failed
progress: 36.0 s, 614.7 tps, lat 13.002 ms stddev 10.520, 0 failed
progress: 42.0 s, 616.7 tps, lat 12.959 ms stddev 11.146, 0 failed
progress: 48.0 s, 638.8 tps, lat 12.515 ms stddev 9.297, 0 failed
progress: 54.0 s, 625.3 tps, lat 12.771 ms stddev 9.631, 0 failed
progress: 60.0 s, 622.3 tps, lat 12.855 ms stddev 10.612, 0 failed
transaction type: <builtin: TPC-B (sort of)>
scaling factor: 1
query mode: simple
number of clients: 8
number of threads: 1
maximum number of tries: 1
duration: 60 s
number of transactions actually processed: 37411
number of failed transactions: 0 (0.000%)
latency average = 12.816 ms
latency stddev = 9.910 ms
initial connection time = 17.793 ms
tps = 623.585760 (without initial connection time)

tps фактически не изменился, как и остальное

-----
CREATE TABLE student2(
  id serial,
  fio char(100)
) WITH (autovacuum_enabled = off);

INSERT INTO student2(fio) SELECT 'noname' FROM generate_series(1,2000000);

SELECT pg_size_pretty(pg_total_relation_size('student2'));
pg_size_pretty
----------------
 269 MB
(1 row)

-----
update student2 set fio = 'name';
update student2 set fio = 'name2';
update student2 set fio = 'name3';
update student2 set fio = 'name4';
update student2 set fio = 'name5';

SELECT pg_size_pretty(pg_total_relation_size('student2'));
pg_size_pretty 
----------------
 1617 MB
(1 row)

-----
SELECT pg_relation_filepath('student2');
 pg_relation_filepath
----------------------
 base/5/24683
(1 row)

-----
select c.relname,
current_setting('autovacuum_vacuum_threshold') as av_base_thresh,
current_setting('autovacuum_vacuum_scale_factor') as av_scale_factor,
(current_setting('autovacuum_vacuum_threshold')::int +
(current_setting('autovacuum_vacuum_scale_factor')::float * c.reltuples)) as av_thresh,
s.n_dead_tup
from pg_stat_user_tables s join pg_class c ON s.relname = c.relname
where s.n_dead_tup > (current_setting('autovacuum_vacuum_threshold')::int
+ (current_setting('autovacuum_vacuum_scale_factor')::float * c.reltuples));

relname  | av_base_thresh | av_scale_factor | av_thresh | n_dead_tup
----------+----------------+-----------------+-----------+------------
 student2 | 25             | 0.1             |      24.9 |    9999900
(1 row)

-----
analyze student;

select c.relname,
current_setting('autovacuum_vacuum_threshold') as av_base_thresh,
current_setting('autovacuum_vacuum_scale_factor') as av_scale_factor,
(current_setting('autovacuum_vacuum_threshold')::int +
(current_setting('autovacuum_vacuum_scale_factor')::float * c.reltuples)) as av_thresh,
s.n_dead_tup
from pg_stat_user_tables s join pg_class c ON s.relname = c.relname
where s.n_dead_tup > (current_setting('autovacuum_vacuum_threshold')::int
+ (current_setting('autovacuum_vacuum_scale_factor')::float * c.reltuples));
 relname  | av_base_thresh | av_scale_factor | av_thresh | n_dead_tup
----------+----------------+-----------------+-----------+------------
 student2 | 25             | 0.1             |  201142.5 |    9988677
(1 row)

-----
ALTER TABLE student2 SET (autovacuum_enabled = off);

SELECT pg_size_pretty(pg_total_relation_size('student2'));
 pg_size_pretty 
----------------
 1617 MB
(1 row)

update student2 set fio = 'name';
update student2 set fio = 'name2';
update student2 set fio = 'name3';
update student2 set fio = 'name4';
update student2 set fio = 'name5';

 pg_size_pretty
----------------
 2964 MB
(1 row)

relname  | av_base_thresh | av_scale_factor |     av_thresh      | n_dead_tup
----------+----------------+-----------------+--------------------+------------
 student2 | 25             | 0.1             | 200401.80000000002 |   19996119
(1 row)

SELECT relname, n_live_tup, n_dead_tup, trunc(100*n_dead_tup/(n_live_tup+1))::float "ratio%", last_autovacuum 
FROM pg_stat_user_TABLEs WHERE relname = 'student2';
 relname  | n_live_tup | n_dead_tup | ratio% | last_autovacuum
----------+------------+------------+--------+-----------------
 student2 |    2003768 |   19996119 |    997 |
(1 row)

живых реальных записей 2003768
мертвых 19996119 записи которые нужно удалить, так как они учавствуют в запросах и т.п.

размер файла значительно увеличился до 2964 MB

-----
ALTER TABLE student2 SET (autovacuum_enabled = on);

 relname  | n_live_tup | n_dead_tup | ratio% |        last_autovacuum
----------+------------+------------+--------+-------------------------------
 student2 |    2020643 |          0 |      0 | 2025-06-03 11:59:05.970855+11
 
 relname | av_base_thresh | av_scale_factor | av_thresh | n_dead_tup
---------+----------------+-----------------+-----------+------------
(0 rows)

pg_size_pretty
----------------
 2964 MB
(1 row)

после включения автовакуума и ожидания его отработки получаем таблицу только с живыми записями,
но размер файла не изменился

vacuum full student2;

postgres=# SELECT pg_size_pretty(pg_total_relation_size('student2'));
 pg_size_pretty 
----------------
 269 MB
(1 row)

